{
  "logo_url": "",
  "tenant_name": "JamBot",
  "header_bg_color": "#0f172a",
  "header_text_color": "#ffffff",
  "accent_color": "#3b82f6",
  "body_font_stack": "-apple-system, BlinkMacSystemFont, \"Segoe UI\", Roboto, sans-serif",
  "footer_copy": "Sent by JamBot — agent-powered communication for local businesses. jam-bot.com",
  "signature_name": "JamBot",
  "signature_title": "Agent Assistant",
  "contact_email": "",
  "contact_phone": "",
  "contact_url": "https://jam-bot.com",
  "unsubscribe_url": "",
  "email_provider": "agentmail",
  "inkbox_inbox": "",
  "inkbox_phone": "",
  "inkbox_phone_id": "",
  "inkbox_api_key_env_var": "INKBOX_API_KEY"
}
